{
  "id" : "ed892c0e-52e0-4cd9-8133-c0ef07b4a709",
  "name" : "Lost item fee policy",
  "description" : "Test lost item fee policy",
  "chargeAmountItem" : {
    "chargeType" : "actualCost",
    "amount" : 0.0
  },
  "lostItemProcessingFee" : 0.0,
  "chargeAmountItemPatron" : true,
  "chargeAmountItemSystem" : true,
  "lostItemChargeFeeFine" : {
    "duration" : 2,
    "intervalId" : "Days"
  },
  "returnedLostItemProcessingFee" : true,
  "replacedLostItemProcessingFee" : true,
  "replacementProcessingFee" : 0.0,
  "replacementAllowed" : true,
  "lostItemReturned" : "Charge"
}
